{
  "$schema": "http://json-schema.org/draft-07/schema#",
  "$id": "meeting.schema.json",
  "title": "Meeting",
  "description": "Syncslids meeting input. LLM: set title, name, items[].topic/description/durationMins. Leave cards empty — filled interactively.",
  "type": "object",
  "required": ["title", "name", "items"],
  "additionalProperties": false,
  "properties": {
    "title": {
      "type": "string",
      "description": "Hero heading on the agenda slide, e.g. 'Q2 Planning'"
    },
    "name": {
      "type": "string",
      "description": "Short label in the top bar, e.g. 'Weekly Sync · 2026-04-13'"
    },
    "defaultTimerMins": {
      "type": "integer",
      "minimum": 1,
      "maximum": 99,
      "default": 10,
      "description": "Agenda-slide countdown in minutes"
    },
    "items": {
      "type": "array",
      "minItems": 1,
      "description": "Ordered agenda items, one slide each",
      "items": { "$ref": "#/$defs/item" }
    }
  },
  "$defs": {
    "item": {
      "type": "object",
      "required": ["topic", "durationMins"],
      "additionalProperties": false,
      "properties": {
        "topic": {
          "type": "string",
          "description": "Agenda item title shown in the slide header and agenda list"
        },
        "description": {
          "type": "string",
          "default": "",
          "description": "One-line context shown beneath the topic"
        },
        "durationMins": {
          "type": "integer",
          "minimum": 1,
          "maximum": 99,
          "description": "Suggested timer for this item in minutes"
        },
        "cards": {
          "type": "array",
          "default": [],
          "description": "Pre-seeded outcome cards. Usually empty — the LLM may seed context cards if helpful.",
          "items": { "$ref": "#/$defs/card" }
        }
      }
    },
    "card": {
      "type": "object",
      "required": ["title"],
      "additionalProperties": false,
      "properties": {
        "title": { "type": "string" },
        "notes": { "type": "string", "default": "" }
      }
    }
  },
  "$comment": "Export format (output only, no presentation fields): { meeting, title, exported_at, items:[{ topic, cards:[{ title, notes }] }] }"
}
