{
  "title": "Today's Topics",
  "name": "Meeting Name · 2026-04-13",
  "defaultTimerMins": 10,
  "items": [
    {
      "topic": "Agenda Item One",
      "description": "Short description of what this covers",
      "durationMins": 15,
      "cards": [
        { "title": "Decision needed", "notes": "What are we deciding today?" },
        { "title": "Key constraint", "notes": "Time / budget / scope" }
      ]
    },
    {
      "topic": "Agenda Item Two",
      "description": "Short description of what this covers",
      "durationMins": 15,
      "cards": [
        { "title": "Action item", "notes": "Owner · due date" },
        { "title": "Open question", "notes": "" }
      ]
    }
  ]
}
